{
  "slug": "command-palette",
  "name": "命令面板",
  "schemaVersion": 3,
  "confidence": "high",
  "implementation": "aham.css",
  "behavior": "aham.js",
  "preview": "examples/parts-actions.html",
  "intent": "⌘K 命令面板：带上下文的分组命令，子列表原地替换",
  "specification": "rules/7-键盘与命令.md#72-命令面板",
  "reference": "examples/list.html",
  "api": "initPalette({ root, groups(ctx), context(), shell, accountItems() }) → { open, close, openAt(label, items), showShortcuts, destroy }。shell: true 时追加界面、账户、跳转、帮助四组并注册 ?；shellGroups(root) 和 shortcutItems() 可单独用；navCommands(root) → 跳转组的命令，取自侧栏带 data-go 的导航项",
  "classes": [
    "wb-palette",
    "wb-palette-context",
    "wb-palette-chip"
  ],
  "variantDimensions": [
    {
      "axis": "context",
      "values": [
        "with-record",
        "none"
      ]
    },
    {
      "axis": "level",
      "values": [
        "root",
        "sub-list"
      ]
    }
  ],
  "anatomy": {
    "parts": [
      "context-chip",
      "search-input",
      "group-heading",
      "item",
      "key-hint",
      "sub-list"
    ],
    "required": [
      "search-input",
      "item"
    ]
  },
  "markup": {
    "item": "<li role=\"option\" data-index=\"0\">[图标]<span class=\"wb-command-label\"><span>修改阶段…</span></span><span class=\"wb-kbd-group\"><kbd class=\"wb-kbd\">S</kbd></span>[arrow-right]</li>"
  },
  "rules": [
    "⌘ / Ctrl + K 开关；模态，宽 640px，距顶 22vh；搜索框 48px，行高 40px，列表最高 384px",
    "页面上的全部操作都要能在面板里找到；有快捷键的命令显示按键",
    "组顺序：当前记录 → AI → 操作 → 界面 → 跳转 → 帮助（rules/7-键盘与命令.md 7.2）",
    "带「…」的命令进入子列表，原地替换；Esc 或空搜索框退格返回",
    "上下文标签可用退格或 ✕ 移除",
    "执行后关闭并还焦点，用轻提示确认结果",
    "每个工作台页面都有命令面板；页面上的按钮都能在面板里搜到"
  ],
  "states": [
    "root",
    "sub-list",
    "no-results",
    "with-context"
  ],
  "keyboard": [
    "⌘ / Ctrl + K 开关",
    "↑↓ 移动，Enter 执行",
    "Esc 返回上级或关闭",
    "空搜索框退格：返回上级或移除上下文"
  ],
  "accessibility": [
    "原生 dialog showModal，焦点困在面板内",
    "搜索框 combobox + aria-activedescendant"
  ],
  "doNotInvent": [
    "显示没有实现的快捷键提示",
    "级联弹出子菜单",
    "执行后停留在面板里",
    "只能通过按钮完成、面板里找不到的操作"
  ]
}
