{
  "slug": "settings-page",
  "name": "设置页",
  "schemaVersion": 3,
  "confidence": "high",
  "implementation": "aham.css",
  "behavior": "aham.js",
  "preview": "examples/settings.html",
  "reference": "examples/settings.html",
  "specification": "rules/4-页面.md#49-设置页",
  "intent": "工作区设置页：左侧分组导航，右侧居中的分区与设置行；修改影响所有人，先改后保存",
  "variantDimensions": [
    {
      "axis": "control",
      "values": [
        "switch",
        "select",
        "segmented",
        "button"
      ]
    },
    {
      "axis": "section",
      "values": [
        "default",
        "danger"
      ]
    }
  ],
  "anatomy": {
    "parts": [
      "header-row",
      "settings-nav",
      "nav-group",
      "settings-content",
      "title",
      "section",
      "row",
      "row-title",
      "row-description",
      "control"
    ],
    "required": [
      "settings-nav",
      "section",
      "row"
    ]
  },
  "markup": {
    "row": "<div class=\"wb-setting\"><div><div class=\"wb-setting-title\" id=\"l-digest\">每日摘要邮件</div><div class=\"wb-setting-desc\">每天 8:30 汇总前一天的变化</div></div><div class=\"wb-setting-control\"><label class=\"wb-switch\"><input type=\"checkbox\" aria-labelledby=\"l-digest\"><span aria-hidden=\"true\"></span></label></div></div>",
    "layout": "<div class=\"wb-settings-layout\"><nav class=\"wb-settings-nav\">…</nav><div class=\"wb-settings-scroll\"><main class=\"wb-settings\">…</main></div></div>"
  },
  "rules": [
    "设置导航 220px 放在内容区左列，分组排列，当前页灰底；1024px 及以下移到顶部横向滚动",
    "内容最宽 640px；页标题 20px 字重 600；分区标题 13px 字重 500；分区间距 32px",
    "设置行用横线分隔，不加卡片边框；左标题 + 说明，右控件；最小高 64px",
    "破坏性操作放最后一个分区，红色文字按钮 + 确认框",
    "只放工作区级的配置；个人偏好放账户菜单里的分栏弹窗（preferences-dialog）",
    "有修改时底部出现保存栏：「有 n 项修改未保存」、放弃修改、保存；mod+s 保存",
    "有未保存的修改时离开页面先问",
    "设置行之间用 --wb-line-soft"
  ],
  "states": [
    "default",
    "dirty",
    "saved",
    "error"
  ],
  "keyboard": [
    "设置导航是链接列表，Tab 移动",
    "控件原生可键盘操作；开关聚焦显示焦点环"
  ],
  "accessibility": [
    "每个控件通过 aria-labelledby 关联行标题",
    "内容滚动区有可访问名并可聚焦"
  ],
  "doNotInvent": [
    "带边框阴影的设置卡片",
    "每个设置旁边一个保存按钮",
    "把设置导航塞进全局侧栏",
    "个人偏好写进工作区设置页"
  ]
}
