{
  "slug": "stage-track",
  "name": "带事件的阶段条",
  "schemaVersion": 3,
  "confidence": "high",
  "implementation": "aham.css",
  "preview": "examples/parts-record.html",
  "intent": "阶段站点加每条往来记录落在线上的位置，当前阶段按停留时间拉长，标出今天",
  "specification": "rules/3-控件.md#317-带事件的阶段条",
  "classes": [
    ".wb-stage-event",
    ".wb-stage-stop",
    ".wb-stage-today",
    ".wb-stage-track",
    ".wb-stage-track-done",
    ".wb-stage-track-foot",
    ".wb-stage-track-gap",
    ".wb-stage-track-head",
    ".wb-stage-track-legend",
    ".wb-stage-track-line",
    ".wb-stage-track-note",
    ".wb-stage-track-rail",
    ".wb-stage-track-scroll",
    ".wb-at-0",
    ".wb-at-1",
    ".wb-at-10",
    ".wb-at-100",
    ".wb-at-11",
    ".wb-at-12",
    ".wb-at-13",
    ".wb-at-14",
    ".wb-at-15",
    ".wb-at-16",
    ".wb-at-17",
    ".wb-at-18",
    ".wb-at-19",
    ".wb-at-2",
    ".wb-at-20",
    ".wb-at-21",
    ".wb-at-22",
    ".wb-at-23",
    ".wb-at-24",
    ".wb-at-25",
    ".wb-at-26",
    ".wb-at-27",
    ".wb-at-28",
    ".wb-at-29",
    ".wb-at-3",
    ".wb-at-30",
    ".wb-at-31",
    ".wb-at-32",
    ".wb-at-33",
    ".wb-at-34",
    ".wb-at-35",
    ".wb-at-36",
    ".wb-at-37",
    ".wb-at-38",
    ".wb-at-39",
    ".wb-at-4",
    ".wb-at-40",
    ".wb-at-41",
    ".wb-at-42",
    ".wb-at-43",
    ".wb-at-44",
    ".wb-at-45",
    ".wb-at-46",
    ".wb-at-47",
    ".wb-at-48",
    ".wb-at-49",
    ".wb-at-5",
    ".wb-at-50",
    ".wb-at-51",
    ".wb-at-52",
    ".wb-at-53",
    ".wb-at-54",
    ".wb-at-55",
    ".wb-at-56",
    ".wb-at-57",
    ".wb-at-58",
    ".wb-at-59",
    ".wb-at-6",
    ".wb-at-60",
    ".wb-at-61",
    ".wb-at-62",
    ".wb-at-63",
    ".wb-at-64",
    ".wb-at-65",
    ".wb-at-66",
    ".wb-at-67",
    ".wb-at-68",
    ".wb-at-69",
    ".wb-at-7",
    ".wb-at-70",
    ".wb-at-71",
    ".wb-at-72",
    ".wb-at-73",
    ".wb-at-74",
    ".wb-at-75",
    ".wb-at-76",
    ".wb-at-77",
    ".wb-at-78",
    ".wb-at-79",
    ".wb-at-8",
    ".wb-at-80",
    ".wb-at-81",
    ".wb-at-82",
    ".wb-at-83",
    ".wb-at-84",
    ".wb-at-85",
    ".wb-at-86",
    ".wb-at-87",
    ".wb-at-88",
    ".wb-at-89",
    ".wb-at-9",
    ".wb-at-90",
    ".wb-at-91",
    ".wb-at-92",
    ".wb-at-93",
    ".wb-at-94",
    ".wb-at-95",
    ".wb-at-96",
    ".wb-at-97",
    ".wb-at-98",
    ".wb-at-99",
    ".wb-fill-0",
    ".wb-fill-1",
    ".wb-fill-10",
    ".wb-fill-100",
    ".wb-fill-11",
    ".wb-fill-12",
    ".wb-fill-13",
    ".wb-fill-14",
    ".wb-fill-15",
    ".wb-fill-16",
    ".wb-fill-17",
    ".wb-fill-18",
    ".wb-fill-19",
    ".wb-fill-2",
    ".wb-fill-20",
    ".wb-fill-21",
    ".wb-fill-22",
    ".wb-fill-23",
    ".wb-fill-24",
    ".wb-fill-25",
    ".wb-fill-26",
    ".wb-fill-27",
    ".wb-fill-28",
    ".wb-fill-29",
    ".wb-fill-3",
    ".wb-fill-30",
    ".wb-fill-31",
    ".wb-fill-32",
    ".wb-fill-33",
    ".wb-fill-34",
    ".wb-fill-35",
    ".wb-fill-36",
    ".wb-fill-37",
    ".wb-fill-38",
    ".wb-fill-39",
    ".wb-fill-4",
    ".wb-fill-40",
    ".wb-fill-41",
    ".wb-fill-42",
    ".wb-fill-43",
    ".wb-fill-44",
    ".wb-fill-45",
    ".wb-fill-46",
    ".wb-fill-47",
    ".wb-fill-48",
    ".wb-fill-49",
    ".wb-fill-5",
    ".wb-fill-50",
    ".wb-fill-51",
    ".wb-fill-52",
    ".wb-fill-53",
    ".wb-fill-54",
    ".wb-fill-55",
    ".wb-fill-56",
    ".wb-fill-57",
    ".wb-fill-58",
    ".wb-fill-59",
    ".wb-fill-6",
    ".wb-fill-60",
    ".wb-fill-61",
    ".wb-fill-62",
    ".wb-fill-63",
    ".wb-fill-64",
    ".wb-fill-65",
    ".wb-fill-66",
    ".wb-fill-67",
    ".wb-fill-68",
    ".wb-fill-69",
    ".wb-fill-7",
    ".wb-fill-70",
    ".wb-fill-71",
    ".wb-fill-72",
    ".wb-fill-73",
    ".wb-fill-74",
    ".wb-fill-75",
    ".wb-fill-76",
    ".wb-fill-77",
    ".wb-fill-78",
    ".wb-fill-79",
    ".wb-fill-8",
    ".wb-fill-80",
    ".wb-fill-81",
    ".wb-fill-82",
    ".wb-fill-83",
    ".wb-fill-84",
    ".wb-fill-85",
    ".wb-fill-86",
    ".wb-fill-87",
    ".wb-fill-88",
    ".wb-fill-89",
    ".wb-fill-9",
    ".wb-fill-90",
    ".wb-fill-91",
    ".wb-fill-92",
    ".wb-fill-93",
    ".wb-fill-94",
    ".wb-fill-95",
    ".wb-fill-96",
    ".wb-fill-97",
    ".wb-fill-98",
    ".wb-fill-99"
  ],
  "variantDimensions": [
    {
      "axis": "data-state",
      "values": [
        "past",
        "now",
        "future",
        "end",
        "won",
        "lost"
      ]
    }
  ],
  "markup": {
    "track": "<section class=\"wb-stage-track\" aria-label=\"推进阶段\"><div class=\"wb-stage-track-head\"><h2>推进阶段</h2></div><div class=\"wb-stage-track-scroll\"><div class=\"wb-stage-track-rail\" role=\"img\" aria-label=\"推进阶段：当前在方案论证\"><div class=\"wb-stage-track-line\"><div class=\"wb-stage-track-done wb-fill-62\"></div></div><a class=\"wb-stage-event wb-at-20 is-strong t1\" href=\"#\"><b>09-15 拜访</b><i></i></a><div class=\"wb-stage-today wb-at-62\"><span>今天</span></div><div class=\"wb-stage-stop wb-at-30\" data-state=\"now\"><i></i><b>方案论证</b><small>10-09 起 · 19 天</small></div></div></div><div class=\"wb-stage-track-foot\"><span class=\"wb-stage-track-legend\"><i class=\"is-strong\"></i>拜访<i></i>电话<em></em>今天</span><span class=\"wb-stage-track-gap\">17 天没有跟进</span></div></section>"
  },
  "rules": [
    "站点写阶段名和一行说明：进站日期、停留天数、建议天数或计划日期",
    "当前阶段那一段拉长到其他段的 3 倍",
    "面对面的记录用实心点 .is-strong，其他用空心点；点可以链接到那条记录",
    "点上不写日期，日期和内容写在 title 里，悬停看",
    "位置只用 .wb-at-N / .wb-fill-N 档位类，不写内联样式",
    "最少 680px 宽，窄屏横向滚动",
    "线 4px，站点 14px，记录点 8px；走过的站实心蓝，当前站实心蓝加浅蓝外圈，没到的站和签约站空心；赢单绿色、输单红色",
    "当前站的名称蓝色、字重 600，其他站字重 400",
    "说明和图例不常驻：写进标题行右侧「?」按钮的悬停提示；.wb-stage-track-foot 只放断档这类要提醒的话（.wb-stage-track-gap）"
  ],
  "accessibility": [
    "轨道写 role=\"img\" 和 aria-label：当前阶段和记录条数",
    "每个点在 .sr-only 里写日期和内容"
  ],
  "doNotInvent": [
    "用分类色给阶段上色",
    "把关键信息里的数字再画到阶段条上",
    "点上写长文本"
  ]
}
