{
  "slug": "create-dialog",
  "name": "新建弹窗",
  "schemaVersion": 3,
  "confidence": "high",
  "implementation": "aham.css",
  "behavior": "aham.js",
  "preview": "examples/parts-actions.html",
  "intent": "快速新建：无边框标题、说明、属性标签、继续新建",
  "specification": "rules/4-页面.md#42-页型",
  "reference": "examples/list.html",
  "api": "openCreateDialog({ root, title, scope, fields, onSubmit(values) → boolean, returnFocus?, nameLabel?, inputs?, description?, check?(values) → string | null })",
  "classes": [
    "wb-create",
    "wb-create-head",
    "wb-create-scope",
    "wb-create-name",
    "wb-create-desc",
    "wb-create-props",
    "wb-create-foot",
    "wb-create-actions"
  ],
  "variantDimensions": [
    {
      "axis": "footer",
      "values": [
        "default",
        "confirm-discard"
      ]
    }
  ],
  "anatomy": {
    "parts": [
      "scope",
      "title-input",
      "error",
      "description",
      "property-chips",
      "create-more",
      "cancel",
      "create",
      "discard-confirm"
    ],
    "required": [
      "title-input",
      "create"
    ]
  },
  "rules": [
    "C 或「新建」主按钮打开；模态，宽 640px，距顶 16vh",
    "标题为空时在标题下方文字提示并阻止创建",
    "⌘ / Ctrl + Enter 创建",
    "继续新建：成功后清空标题与说明、保留属性、焦点回到标题",
    "有未保存内容时关闭，底栏原地换成「继续编辑 / 放弃 / 创建」，焦点在「继续编辑」",
    "有明细表和金额的单据走整页单据",
    "异步提交按 rules/11-交互.md 11.7 执行：成功后才关闭或清空，等待期间不重复提交，失败保留内容并可重试"
  ],
  "states": [
    "empty",
    "typing",
    "invalid",
    "creating",
    "confirm-discard",
    "saving",
    "error",
    "retry"
  ],
  "keyboard": [
    "⌘ / Ctrl + Enter 创建",
    "Esc 关闭或进入放弃确认"
  ],
  "accessibility": [
    "原生 dialog showModal；标题输入 aria-describedby 指向错误文字",
    "属性浮层放在弹窗内部，避免被 inert"
  ],
  "doNotInvent": [
    "用轻提示报标题必填",
    "叠第二个确认弹窗",
    "把复杂单据塞进快速新建"
  ]
}
