{
  "slug": "list-keyboard",
  "name": "列表键盘",
  "schemaVersion": 3,
  "confidence": "high",
  "implementation": "aham.css",
  "behavior": "aham.js",
  "preview": "examples/parts-detail.html",
  "intent": "Linear 式列表键盘：当前行在 Tab 顺序里，方向键移动，空格预览，Enter 打开，x 勾选",
  "specification": "rules/4-页面.md#47-列表键盘和预览",
  "reference": "examples/list.html",
  "api": "initListKeys({ table, onPreview, onOpen, onToggle, onMove, onRange }) → { refresh, current, focus, destroy }",
  "variantDimensions": [
    {
      "axis": "preview",
      "values": [
        "closed",
        "open"
      ]
    }
  ],
  "anatomy": {
    "parts": [
      "current-row",
      "previewing-row",
      "preview-panel"
    ],
    "required": [
      "current-row"
    ]
  },
  "rules": [
    "只有当前行 tabindex=0，其他行 -1；每次重绘后调用 refresh",
    "键只在行本身有焦点时生效，行内控件保留自己的键",
    "空格预览时焦点留在列表，移动当前行时预览跟着切换",
    "Esc 或再按空格关闭预览，焦点回到当前行",
    "焦点行浅灰底 + 蓝色细边线，正在预览的行浅灰底",
    "Shift + ↑↓ 从当前行扩展勾选范围，Shift + 点击勾选框把新状态应用到两次点击之间的所有行；onRange(ids, on) 接收范围"
  ],
  "keyboard": [
    "↑ ↓ 移动当前行",
    "Home / End 到首尾",
    "空格 打开 / 关闭预览",
    "Enter 打开详情",
    "x 勾选 / 取消勾选",
    "Shift + ↑ ↓ 扩展勾选范围",
    "Esc 关闭预览"
  ],
  "states": [
    "idle",
    "focused",
    "previewing",
    "selected"
  ],
  "accessibility": [
    "不声明 ARIA grid",
    "输入法组字时不响应",
    "焦点不只靠颜色：焦点行有边线"
  ],
  "doNotInvent": [
    "每个单元格都进 Tab 顺序",
    "用蓝色整行底色表示焦点",
    "按住修饰键时拦截方向键"
  ]
}
