{
  "slug": "shortcuts",
  "name": "快捷键",
  "schemaVersion": 3,
  "confidence": "high",
  "implementation": "aham.css",
  "behavior": "aham.js",
  "preview": "examples/parts-actions.html",
  "intent": "统一快捷键表：登记后才能出现在界面提示和帮助列表里",
  "specification": "rules/7-键盘与命令.md#71-快捷键表",
  "reference": "examples/list.html",
  "api": "registerShortcut({ keys, label, group, when?, run?, external? }) / listShortcuts() / formatKeys(keys) / setSingleKeyShortcuts(on) / singleKeyShortcuts() / initTooltips(root)",
  "variantDimensions": [
    {
      "axis": "scope",
      "values": [
        "global",
        "list",
        "detail",
        "input"
      ]
    }
  ],
  "anatomy": {
    "parts": [
      "registry",
      "help-list",
      "kbd-hint"
    ],
    "required": [
      "registry"
    ]
  },
  "reserved": {
    "mod+k": "命令面板",
    "mod+b": "展开 / 收起导航",
    "?": "键盘快捷键",
    "escape": "关闭最上层的浮层",
    "c": "新建当前页的对象",
    "/": "搜索",
    "up": "上一行",
    "down": "下一行",
    "home": "第一行",
    "end": "最后一行",
    "space": "预览当前行",
    "enter": "打开当前行",
    "x": "勾选当前行",
    "shift+up": "向上扩展勾选范围",
    "shift+down": "向下扩展勾选范围",
    "s": "修改状态类主属性",
    "a": "修改负责人",
    "shift+f10": "当前行的操作菜单",
    "j": "下一条",
    "k": "上一条",
    "e": "编辑当前单据（进入编辑态）",
    "mod+enter": "提交评论、新建，或保存编辑态",
    "left": "折叠当前层 / 回到上一层（树形明细）",
    "right": "展开当前层 / 进入下一层（树形明细）",
    "+": "放大（文件预览）",
    "-": "缩小（文件预览）",
    "0": "适合页面（文件预览）",
    "pageup": "上一页（文件预览）",
    "pagedown": "下一页（文件预览）"
  },
  "rules": [
    "单字母快捷键只在焦点不在输入框、输入法未组字时生效；mod 组合键在输入框里也生效",
    "保留键不得改作他用；新增快捷键先登记再显示提示",
    "帮助列表按组显示已登记的按键，由 ? 打开",
    "macOS 显示 ⌘ ⇧ ⌥，其他系统显示 Ctrl Shift Alt",
    "单字母快捷键可以在设置里整体关闭（WCAG 2.1.4），setSingleKeyShortcuts(false)，选择记在本机；关闭后帮助列表和按钮提示不再显示这些键",
    "按钮提示（rules/7-键盘与命令.md 7.5）：data-tooltip 写名称，data-keys 写已登记的按键；悬停 500ms 或键盘聚焦时出现，任意按键、移开、滚动、点击时消失"
  ],
  "states": [
    "idle",
    "sequence-pending"
  ],
  "keyboard": [
    "? 打开帮助"
  ],
  "accessibility": [
    "有快捷键的菜单项带 aria-keyshortcuts"
  ],
  "doNotInvent": [
    "界面上显示没登记的快捷键",
    "在输入框里拦截单字母键",
    "把保留键挪作他用",
    "没有关闭开关的全局单字母快捷键",
    "用 title 属性代替按钮提示"
  ]
}
